# name: test/sql/local/paimon_write.test
# group: [local]
#
# Write path: CREATE TABLE + INSERT through the Paimon catalog, then read back. The written tables
# are also verified to be readable by pypaimon (the reference implementation) in the cross-engine
# checks under scripts/ — here we assert the in-engine round trip.

require avro

require parquet

statement ok
LOAD '__WORKING_DIRECTORY__/build/release/extension/iceberg/paimon.duckdb_extension';

statement ok
ATTACH '__TEST_DIR__' AS pm (TYPE paimon);

statement ok
CREATE TABLE pm.paimon_write_t (id BIGINT, name VARCHAR, score DOUBLE);

statement ok
INSERT INTO pm.paimon_write_t SELECT i, 'name_' || i, i * 1.5 FROM range(10) t(i);

# Read back the first commit.
query III
SELECT count(*), sum(id), round(sum(score), 1) FROM pm.paimon_write_t;
----
10	45	67.5

query T
SELECT name FROM pm.paimon_write_t ORDER BY id LIMIT 3;
----
name_0
name_1
name_2

# A second INSERT must append (carry prior manifests forward), not replace.
statement ok
INSERT INTO pm.paimon_write_t SELECT i, 'name_' || i, i * 1.5 FROM range(10, 15) t(i);

query II
SELECT count(*), sum(id) FROM pm.paimon_write_t;
----
15	105

# Two APPEND snapshots exist after two commits.
query IT
SELECT snapshot_id, commit_kind FROM paimon_snapshots('__TEST_DIR__/paimon_write_t') ORDER BY snapshot_id;
----
1	APPEND
2	APPEND

# --- Primary-key write: INSERT writes system columns; a later INSERT of an existing key upserts. ---
statement ok
CREATE TABLE pm.pk_w (id BIGINT PRIMARY KEY, v VARCHAR);

statement ok
INSERT INTO pm.pk_w SELECT i, 'a' || i FROM range(5) t(i);

statement ok
INSERT INTO pm.pk_w VALUES (2, 'updated'), (5, 'new');

# Merge-on-read: id 2 upserted to 'updated', id 5 appended; 6 distinct keys.
query IT
SELECT id, v FROM pm.pk_w ORDER BY id;
----
0	a0
1	a1
2	updated
3	a3
4	a4
5	new

# DELETE writes delete tombstones; merge-on-read then drops those keys.
statement ok
DELETE FROM pm.pk_w WHERE id IN (0, 5);

query IT
SELECT id, v FROM pm.pk_w ORDER BY id;
----
1	a1
2	updated
3	a3
4	a4

# A re-INSERT of a previously deleted key brings it back (higher sequence wins).
statement ok
INSERT INTO pm.pk_w VALUES (0, 'reborn');

query IT
SELECT id, v FROM pm.pk_w WHERE id = 0;
----
0	reborn

# UPDATE rewrites matched rows (upsert with the new value); unchanged columns are preserved.
statement ok
UPDATE pm.pk_w SET v = 'patched' WHERE id IN (2, 4);

query IT
SELECT id, v FROM pm.pk_w ORDER BY id;
----
0	reborn
1	a1
2	patched
3	a3
4	patched

# DROP removes the table from the catalog and deletes its directory.
statement ok
DROP TABLE pm.paimon_write_t;

statement error
SELECT count(*) FROM pm.paimon_write_t;
----

statement ok
DETACH pm;
